{
  "schema": "acp.review-verdict.v2",
  "reviewed_commit": "efac29fd9abfa9578c8f88bfd27937eb3c05a856",
  "review_type": "self-verification",
  "review_basis": "pull-request",
  "reviewer": "slarti",
  "verdict": "consistency-verified",
  "blocking_findings": [],
  "remaining_followups": [
    "Canonical Homelab/Architecture PR #109 is awaiting independent review and merge.",
    "Operator gate slarti/backlog#283 must produce zero-failure, zero-skip service evidence at the merged SHA."
  ],
  "supersedes_review": "https://github.com/yeraziael/slartis-backlog/pull/108 at 7bb0d8abcedf29c1ad17b38b8825f860206cfca1",
  "review_timestamp": "2026-07-28T10:23:07Z"
}
