{
  "schema": "acp.review-verdict.v2",
  "reviewed_commit": "3362689b63a8e557b8f1a8ac160fed066677ec32",
  "review_type": "self-verification",
  "review_basis": "merge-commit",
  "reviewer": "slarti",
  "verdict": "consistency-verified",
  "blocking_findings": [],
  "remaining_followups": [
    "Retention scheduler and artifact upload are intentionally deferred.",
    "OCR/redaction for screenshot pixels is deferred."
  ],
  "supersedes_review": "yeraziael/slartis-backlog#99",
  "review_timestamp": "2026-07-26T16:12:55+01:00"
}
