{
  "schema": "acp.review-verdict.v2",
  "reviewed_commit": "7f9c7252572a53cd6367d1d17f5a25b3683a4879",
  "review_type": "self-verification",
  "review_basis": "pull-request",
  "reviewer": "slarti",
  "verdict": "consistency-verified",
  "blocking_findings": [],
  "remaining_followups": [
    "The canonical PR is awaiting merge.",
    "Screenshot pixel OCR/redaction remains deferred."
  ],
  "supersedes_review": "yeraziael/slartis-backlog#100 at 69f7681896198cfdc74c5ff63e13787b593ec768",
  "review_timestamp": "2026-07-26T18:06:43+01:00"
}
